Date,Location,Level,Type,Title/Description ,Comments,Travel restrictions,State of Emergency,School Closure ,Work Closure,Business closing,Gatherings,COVID/Antibody Testing,Safer at Home,Reopening,Relief/Funding/Grant,Masks,Other,Economics
5/6/2020,Oregon,State,Issued,Oregon Department of Consumer and Business Services issued  an emergency order for health insurance companies,"Requires them to: provide at least a 60-day grace period to pay any past due premiums; pay claims for any covered services during the first 30 days of the grace period; and, extend all deadlines for reporting claims and other communications, and provide members with communication options to meet physical distancing standards.",,,,,,,,,,,,,
5/7/2020,Oregon,State,Announcement,"Governor announced additional details of the Reopening Oregon framework, including guidance for counties and businesses on the phased reopening process",,,,,,,,,,,,,,
5/8/2020,Oregon,State,Authorization,Centers for Medicare and Medicaid Services (CMS) approved Oregon’s second request for a Medicaid 1135 waiver,"The waiver allows Oregon to waive consent requirements for Home and Community-Based Services(HCBS), forgo evaluation and assessment requirements for HCBS, reimburse for HCBS services provided at an entity that also provides case management services, allow for HCBS in additional settings, and to modify timelines for levels of care determinations",,,,,,,,,,,,,
5/11/2020,Oregon,State,Announcement,"Governor, together with the Western Pact states, sent a letter to Congressional leadership requesting $1 trillion in direct and flexible relief to states and local governments to avoid deep cuts to services like public health, public safety, public education and help people get back to work",,,,,,,,,,,,,,
5/14/2020,Oregon,State,Announcement,Governor announced 28 counties were approved to begin entering Phase 1 of reopening on May 15 under the state’s reopening framework.,,,,,,,,,,,,,,
5/15/2020,Oregon,State,Announcement,Governor released statewide guidance for jurisdictions and businesses across the state as they begin Phase 1 of reopening.,,,,,,,,,,,,,,
5/22/2020,Oregon,State,Announcement,Governor urged members of the public to “stay local and to stay safe” during the Memorial Day holiday weekend. She was joined by 26 mayors making this request of the public,,,,,,,,,,,,,,
5/27/2020,Oregon,State,Announcement,Oregon Department of Environmental Quality shared examples of Oregonian food workers,,,,,,,,,,,,,,
5/28/2020,Oregon,State,Announcement,Governor announced that Washington County can begin entering Phase 1 of reopening on June 1 under the state’s framework for a safe and strong reopening,,,,,,,,,,,,,,
5/28/2020,Oregon,State,Issued,"Oregon Department of Consumer and Business Services’ Division of Financial Regulation issued emergency orders for property and casualty, long-term care, and life and disability insurance","This process provides two important protections for Oregonians: A sustainable way for insurance customers to keep up with premium payments without falling behind; and, Insurance protection for a specific number of days for customers that are in a grace period.",,,,,,,,,,,,,
5/29/2020,Oregon,State,Announcement,Governor announced a $30 million investment to secure the state’s food supply chain and protect essential agricultural workers.,,,,,,,,,,,,,,
6/3/2020,Oregon,State,Announcement,"Governor announced details about Phase 2 of reopening, with 31 counties progressing to Phase 2 on June 5","Counties approved to enter Phase 2 must continue to meet Phase 1 metrics, including: Declining disease prevalence; Having an adequate number of contact tracers, including people reflective of the communities they serve; Establishing adequate testing, isolation and quarantine facilities, sufficient hospital surge capacity, and sufficient personal protective equipment supply; Counties must also meet additional prerequisites, including:
Demonstrating that they can trace new cases within 24 hours;
As counties see new cases, they must be able to identify where they are coming from at least 70% of the time; and,
Counties cannot be experiencing a significant increase in cases.",,,,,,,,,,,,,
6/5/2020,Oregon,State,Authorization,Governor approved 3 counties to move to phase 2 reopening on June 6.,,,,,,,,,,,,,,
6/9/2020,Oregon,State,Announcement,"Governor announced the state is implementing a comprehensive coronavirus testing plan to protect the residents and staff of long-term care facilities, prioritizing those facilities at greatest risk for outbreaks. Additionally, public health officials will be working with long-term care facilities to implement recommended best practices for ongoing monitoring","Including: Conducting active daily screenings for fever and COVID-like symptoms for all residents and staff, providing testing for any residents or staff with even mild symptoms. Residents who test positive should be isolated; Providing testing for all staff every month on a staggered weekly basis, with the goal of having 25 percent of all staff tested each week over the course of a month; Providing testing for all residents and staff if there is a single new confirmed or suspected resident case or a confirmed staff case, and retesting weekly until at least 14 days pass without a new positive result. Residents who test positive and are symptomatic should be isolated; and, Testing all new residents prior to admission or readmission, including transfers from hospitals or other health care facilities. Even new residents who test negative should be quarantined for 14 days.",,,,,,,,,,,,,
6/10/2020,Oregon,State,Announcement,"Governor announced she will be convening a Health Schools Reopening Council to advise her and the Oregon Department of Education (ODE) during the Ready Schools, Safe Learners K-12 schools reopening process. ","Council will be charged with:
Giving feedback on equitable policies and practices for a safe return to school;
Informing additional guidance from ODE developed over the summer to help school districts implement their back-to-school plans;
Receiving updates on school district plans and implementation; and,
Reviewing COVID-19 status reports and evaluating outbreak management during the school year.",,,,,,,,,,,,,
6/11/2020,Oregon,State,Announcement,Governor announced all county applications for further reopening are on hold for seven days while public health experts assess which factors are driving the spread of the virus and determine if the state should adjust its approach to reopening.,,,,,,,,,,,,,,
6/15/2020,Oregon,State,Announcement,Oregon Department of Environmental Quality announced it will reopen many of its vehicle inspection stations beginning this week.,,,,,,,,,,,,,,
6/16/2020,Oregon,State,Announcement,Governor announced she will convene a Special Session of the Oregon Legislature to take up proposed legislation to improve police accountability and address the COVID-19 pandemic on June 24.,,,,,,,,,,,,,,
6/17/2020,Oregon,State,Announcement,"Governor announced she will be instituting a requirement to wear face coverings while in indoor public spaces for the following counties: Multnomah, Washington, Clackamas, Hood River, Marion, Polk, and Lincoln. This mandate will take effect June 24.",,,,,,,,,,,,,,
6/17/2020,Oregon,State,Announcement,"Governor announced she is moving Marion, Polk, and Hood River Counties to Phase 2 beginning June 19.",,,,,,,,,,,,,,
6/17/2020,Oregon,State,Announcement,Governor announced she is moving Multnomah County to Phase 1 on June 19.,,,,,,,,,,,,,,
6/17/2020,Oregon,State,Announcement,Governor announced she will be grouping several counties together as regional units for future reopening decisions.,,,,,,,,,,,,,,
6/19/2020,Oregon,State,Issued,"Governor issued updated guidance from the Oregon Health Authority regarding the use of face coverings in indoor public spaces for Mulnomah, Clackamas, Washington, Marion, Polk, Hood River, and Lincoln Counties, effective June 24.",,,,,,,,,,,,,,
6/23/2020,Oregon,State,Announcement,"Governor announced the state reached an agreement with 10 insurance companies to continue providing expanded telehealth options through at least December 31. Additionally, the Oregon Health Plan will continue to offer pay parity and other allowances for many telehealth services, offering the same rate as an in-person visit for physical health services, behavioral health services, and some dental and long-term care services.",,,,,,,,,,,,,,
6/26/2020,Oregon,State,Announcement,"Governor announced that Clatsop County will require face coverings in indoor public spaces, effective July 1.",,,,,,,,,,,,,,
6/29/2020,Oregon,State,Announcement,"Governor announced that Oregonians statewide will be required to wear face coverings in indoor public spaces, beginning July 1.",,,,,,,,,,,,,,
6/30/2020,Oregon,State,Declaration,"Governor extended her declaration of a state of emergency for an additional 60 days, until September 4.",,,,,,,,,,,,,,
7/2/2020,Oregon,State,Announcement,Governor launched a statewide public awareness campaign to inform Oregonians about the urgent importance of wearing face coverings when out in public.,,,,,,,,,,,,,,
7/3/2020,Oregon,State,Announcement,"Governor announced new enforcement measures on face covering, physical distancing, and occupancy standards for businesses over the Fourth of July holiday weekend and thereafter.",,,,,,,,,,,,,,
7/7/2020,Oregon,State,Announcement,Governor’s Healthy Schools Reopening Council convened for its first remote meeting to advise the Governor and the Oregon Department of Education as school districts develop their plans for a safe return to school for Oregon’s students.  ,,,,,,,,,,,,,,
2/26/2020,Pennsylvania,State,Authorization,Activated Department of Health's Emergency Operations Center,to allow for enhanced response,,,,,,,,,,,,,
3/5/2020,Pennsylvania,State,Announcement,Arrivals must contact the public health department,"Those who arrived from China, Iran, Italy, or South Korea, within the last 14 days must contact the public health department and practice social distancing for 14 days post travel",,,,,,,,,,,,,
3/5/2020,Pennsylvania,State,Announcement,Updated interim guidance for healthcare professionals,,,,,,,,,,,,,,
3/7/2020,Pennsylvania,State,Announcement,Coordination to allocate resources ,"to support health departments, secure equipment and personnel, disseminate public health messaging, and support care for those most at risk",,,,,,,,,,,,,
3/10/2020,Pennsylvania,State,Issued,Department of Insurance gives notice of preparedness plans to enrollees,regarding the benefits for COVID-19 treatment and testing,,,,,,,,,,,,,
3/11/2020,Pennsylvania,State,Issued,Guidance on restricting travel for state employees,"As well as new directives top address large gatherings, telework, and paid leave for impacted employees",,,,,,,,,,,,,
3/12/2020,Pennsylvania,County,Issued,Guidance for Montgomery County,To reduce spread; also for Pennsylvania in general,,,,,,,,,,,,,
3/13/2020,Pennsylvania,State,Announcement,Closure of Pennsylvania schools,,,,,,,,,,,,,,
3/15/2020,Pennsylvania,County,Issued,"Closure of all dine-in facilities for Allegheny, Bucks, Chester, Delaware, and Montomery counties",for next 14 days,,,,,,,,,,,,,
3/16/2020,Pennsylvania,State,Issued,Closure of all restaurants and dine-in services,For next 14 days,,,,,,,,,,,,,
3/16/2020,Pennsylvania,State,Issued,No-visitor policy for correctional facilities and nursing homes,,,,,,,,,,,,,,
3/16/2020,Pennsylvania,State,Issued,Restrictions around non-essential travel,,,,,,,,,,,,,,
3/16/2020,Pennsylvania,State,Issued,Closure of licensed childcare centers,,,,,,,,,,,,,,
3/16/2020,Pennsylvania,State,Issued,Closure of certain adult facilities,"Adult care centers, training faciligies, Provocations facilities, LIFE centers, and Senior Community Centers",,,,,,,,,,,,,
3/16/2020,Pennsylvania,State,Issued,Visitor restrictions for state centers,To protect those with intellectual disability,,,,,,,,,,,,,
3/16/2020,Pennsylvania,State,Issued,Telework or 10 workday paid absence,10 paid workdays for those without telework capability,,,,,,,,,,,,,
3/16/2020,Pennsylvania,State,Issued,Guidance for non-essential businesses,To close for at least 14 days,,,,,,,,,,,,,
3/16/2020,Pennsylvania,State,Announcement,"Joins CN, NY, and NJ coalition to combat COVID-19","Limit crowd capacity to 50 people; close restaurants and bars - take-out or delivery only; temporary closure of movie theaters, gyms, and casinos",,,,,,,,,,,,,
3/19/2020,Pennsylvania,State,Signed,Executive order suspending all non-life-sustaining business,,,,,,,,,,,,,,
3/19/2020,Pennsylvania,State,Announcement,Low-interest loans for small business,and eligible non-profits through the U.S. Small Business Administration,,,,,,,,,,,,,
3/23/2020,Pennsylvania,State,Issued,Stay at Home” orders to seven highest-burden counties that will be in effect until April 6.,,,,,,,,,,,,,,
3/23/2020,Pennsylvania,State,Announcement,"Updated previous school closure guidance, extending the deadline to at least April 6.",,,,,,,,,,,,,,
3/24/2020,Pennsylvania,State,Announcement,Posted Frequently Asked Questions related to the Executive Order mandating businesses closures for non-life-sustaining businesses ,,,,,,,,,,,,,,
3/25/2020,Pennsylvania,State,Announcement,funding is available for small businesses through a program under the Pennsylvania Industrial Development Authority’s Small Business First Fund,,,,,,,,,,,,,,
3/25/2020,Pennsylvania,County,Announcement,Stay at Home” order to Lehigh,,,,,,,,,,,,,,
3/25/2020,Pennsylvania,County,Announcement,Stay at Home” order to Northampton,,,,,,,,,,,,,,
3/26/2020,Pennsylvania,State,Announcement,web portal to source needed supplies for medical providers,,,,,,,,,,,,,,
3/26/2020,Pennsylvania,State,Announcement,$50 million in transferred state funding will be spent to purchase medical equipment and supplies,,,,,,,,,,,,,,
3/26/2020,Pennsylvania,State,Announcement,Submitted letter to USDA,"Waive eligibility requirements for the Emergency Food Assistance Program;
Reconsider Pennsylvania’s request for temporary waivers to allow more food to be distributed at school feeding sites and food banks; and
Reconsider its interpretation of recent changes to the Supplemental Nutrition Assistance Program to allow for additional flexibility.",,,,,,,,,,,,,
3/27/2020,Pennsylvania,State,Announcement,Medicare and Medicaid approved section 1135 waiver,,,,,,,,,,,,,,
3/27/2020,Pennsylvania,State,Signed,House Bill 1232,provides $50 million to purchase medical equipment and supplies,,,,,,,,,,,,,
3/27/2020,Pennsylvania,State,Signed,Senate Bill 751,"waives the requirement for schools to be in session at least 180 days, provides for continuity of education plans, ensures school employees are paid during the closure, and provides the Secretary of Education with authority to waive student teacher and standardized assessments.",,,,,,,,,,,,,
3/27/2020,Pennsylvania,State,Signed,Senate Bill 422,reschedules the 2020 primary election from April 28 to June 2 and makes other election process changes.,,,,,,,,,,,,,
3/27/2020,Pennsylvania,State,Signed,House Bill 68,applying for unemployment compensation easier for workers by waiving the one week waiting period and job search and work registration requirements for claimants,,,,,,,,,,,,,
3/27/2020,Pennsylvania,State,Announcement,“Stay at Home” orders to include nine additional counties,,,,,,,,,,,,,,
3/28/2020,Pennsylvania,State,Announcement,“Stay at Home” orders to include three additional counties,,,,,,,,,,,,,,
3/28/2020,Pennsylvania,State,Announcement,approved request by the Pennsylvania Department of State to suspend several provisions that create barriers to temporary licensure,"streamlined the process for retired doctors, nurses, medical students, pharmacists, and other healthcare workers, allowed out-of-state practitioners to practice in the state, expanded telemedicine, and launched a portal to purchase medical supplies. ",,,,,,,,,,,,,
3/28/2020,Pennsylvania,State,Announcement,approval for the Pennsylvania Department of Agriculture to operate a Disaster Household Distribution program,,,,,,,,,,,,,,
3/29/2020,Pennsylvania,State,Announcement,requested  major disaster declaration,,,,,,,,,,,,,,
3/30/2020,Pennsylvania,State,Announcement,establishing a policy that strictly prohibits discrimination based on disability or socioeconomic status,,,,,,,,,,,,,,
3/30/2020,Pennsylvania,State,Announcement,“Stay at Home” order to four additional counties,,,,,,,,,,,,,,
3/30/2020,Pennsylvania,State,Announcement,extended stay-at-home orders through April 30 ,,,,,,,,,,,,,,
3/31/2020,Pennsylvania,State,Announcement,governor approval of major disaster declaration,,,,,,,,,,,,,,
3/31/2020,Pennsylvania,State,Announcement,“Stay at Home” order to seven additional counties,,,,,,,,,,,,,,
3/31/2020,Pennsylvania,State,Announcement, stay at home order to all 67 of the state’s counties. The order will continue until April 30.,,,,,,,,,,,,,,
4/3/2020,Pennsylvania,State,Issued,Gudiance on universal masking,,,,,,,,,,,,,,
4/4/2020,Pennsylvania,State,Issued,updated stay-at-home guidance encouraging religious leaders from across the commonwealth to explore and embrace alternative forms of faith gatherings.,,,,,,,,,,,,,,
4/4/2020,Pennsylvania,State,Signed,order providing direction for maintaining and cleaning businesses authorized to maintain in-person operations,"Maintain pre-existing cleaning protocols established in the facility for all other areas of the building;
Clean and disinfect high-touch areas routinely in accordance with CDC guidelines;
Ensure that the facility has the workforce to perform all cleaning protocols in an effective manner; and,
Ensure that the facility has a sufficient number of security employees to control access, maintain order, and enforce social distancing of at least 6 feet.",,,,,,,,,,,,,
4/6/2020,Pennsylvania,State,Announcement,Urged Pennsylvania manufacturers that are currently producing or can pivot to producing COVID-19 related supplies to submit their information to the newly developed Pennsylvania Manufacturing Call to Action,,,,,,,,,,,,,,
4/7/2020,Pennsylvania,State,Announcement,volunteer efforts to distribute meals and other life-sustaining services in Pennsylvania remain an essential activity,,,,,,,,,,,,,,
4/7/2020,Pennsylvania,State,Announcement,public to remain vigilant against hate and compassionate to all peoples after the FBI warned of an uptick in incidents targeting members of the Asian American community due to misinformation and xenophobic,,,,,,,,,,,,,,
4/8/2020,Pennsylvania,State,Signed,"executive order to ensure the efficient allocation and effective use of N95 face masks, ventilators, respirators, face shields, safety goggles, disinfectants ",,,,,,,,,,,,,,
4/9/2020,Pennsylvania,State,Announcement,Closure of schools for the remainder of the academic year,,,,,,,,,,,,,,
4/10/2020,Pennsylvania,State,Ordered,establish a Temporary Program to Reprieve Sentences of Incarceration,help aid the department in the transfer of qualifying individuals to community corrections facilities or home confinement.,,,,,,,,,,,,,
4/10/2020,Pennsylvania,State,Announcement,"$450 million loan package to be made immediately available to the commonwealth’s hospitals to provide financial support for working capital to ensure that these facilities have sufficient personnel, equipment, and personal protective equipment.",,,,,,,,,,,,,,
4/13/2020,Pennsylvania,State,Announcement,"formation of a regional coalition with New Jersey Governor Phil Murphy, Connecticut Governor Ned Lamont, New York Governor Andrew Cuomo, Delaware Governor John Carney, Massachusetts Governor Charlie Baker, and Rhode Island Governor Gina Raimondo to develop a unified regional framework to gradually lift the states’ stay at home orders while minimizing the risk of increased spread of the virus",,,,,,,,,,,,,,
4/14/2020,Pennsylvania,State,Announcement,businesses that collect Pennsylvania sales tax will not have to make Accelerated Sales Tax prepayments over the next three months,,,,,,,,,,,,,,
4/15/2020,Pennsylvania,State,Announcement,"Sent letter to USDA urging them to publish a plan to support agriculture producers, food processors, workers, and local food systems, regardless of size of operation",,,,,,,,,,,,,,
4/15/2020,Pennsylvania,State,Announcement,Department of Revenue is providing relief to economically dislocated Pennsylvanians and businesses ,,,,,,,,,,,,,,
4/15/2020,Pennsylvania,State,Announcement,COVID-19 Response Task Force for Health Disparity that will help communicate issues with how the pandemic is affecting the state’s minority and vulnerable populations.,,,,,,,,,,,,,,
4/15/2020,Pennsylvania,State,Issued,order directing protections for critical workers who are employed at businesses that are authorized to maintain in-person operations,,,,,,,,,,,,,,
4/17/2020,Pennsylvania,State,Announcement,"Gov announced a state plan to provide citizens and businesses relief, allow for a safe and expedient reopening and outline a statewide recovery",,,,,,,,,,,,,,
4/18/2020,Pennsylvania,State,Announcement,Gov announced nearly $16 million in funding for Pennsylvania food banks to ensure Pennsylvanians are adequately fed and receive the assistance they need,,,,,,,,,,,,,,
4/20/2020,Pennsylvania,State,Signed,"Gov signed Senate Bill 841, which provides flexibility on property tax deadlines, allows remote public meetings and notarization of documents so online vehicle sales can resume",Reauthorizes the Pennsylvania Health Care Cost Containment Council and requires it to study the impact of COVID-19 on hospitals and health systems; Allows local governments to conduct remote public meetings; Provides property tax relief by allowing taxing districts to waive late fees and penalties for property taxes paid by December 31; Allows school districts to renegotiate contracts with service providers to ensure payment of personnel and fixed costs during the school closure; Allows remote notarization of documents.,,,,,,,,,,,,,
4/20/2020,Pennsylvania,State,Announcement,"Gov announced three actions including: enabling online sales of vehicles, restarting construction projects statewide, and allowing curbside pickup of wine and spirits at select Pennsylvania Liquor Control Board locations",,,,,,,,,,,,,,
4/20/2020,Pennsylvania,State,Announcement,Gov announced that the statewide stay-at-home orders will be extended to May 8th,,,,,,,,,,,,,,
4/22/2020,Pennsylvania,State,Announcement,Gov released a detailed plan to reopen the Commonwealth utilizing a phased approach with phase one beginning  May 8th,,,,,,,,,,,,,,
4/22/2020,Pennsylvania,State,Announcement,Gov announced that the Department of State has launched an awareness campaign to inform the public about the new primary election date and how to apply for a mail-in ballot,,,,,,,,,,,,,,
4/23/2020,Pennsylvania,State,Issued,"Gov issued guidance for all construction businesses and employees to mitigate the spread of COVID-19 as operations resume on May 1, one week earlier than previously announced",,,,,,,,,,,,,,
4/27/2020,Pennsylvania,State,Announcement,Gov announced the lifting of some restrictions on businesses related to certain outdoor activities will start on May 1,,,,,,,,,,,,,,
4/28/2020,Pennsylvania,State,Issued,Gov sent a letter to the members of Pennsylvania’s congressional delegation urging Congress to take legislative action to ensure access to the Supplemental Nutrition Assistance Program (SNAP) to those who need it during the recovery months ahead,,,,,,,,,,,,,,
4/28/2020,Pennsylvania,State,Issued,"Gov sent a letter to the United States Department of Agriculture (USDA) requesting reconsiderations for interpretations of SNAP made by the USDA’s Food and Nutrition Service, which denied the state’s request to allow college students to be counted towards their household’s benefit and determined that time-limited pandemic unemployment compensation would be counted as income, potentially disqualifying households that would have otherwise qualified",,,,,,,,,,,,,,
4/29/2020,Pennsylvania,State,Signed,Gov signed 1) House Bill 1869 allows for National Guard members called to active duty to be covered under the Heart and Lung Act if they contract COVID-19 while performing their duties 2) House Bill 752 provides for the Game Commission to pay a fair market value for land in Allegheny County,,,,,,,,,,,,,,
4/30/2020,Pennsylvania,State,Announcement,"Gov announced at least $324 million in funding has been awarded to 31 hospitals across the commonwealth through the Hospital Emergency Loan Program, which provides short-term financial relief as hospitals combat the surge of cases in their region",,,,,,,,,,,,,,
5/1/2020,Pennsylvania,State,Announcement,"Gov announced the reopening of 24 counties in the northwest and north-central regions of the state, moving from red to yellow on May 8.",,,,,,,,,,,,,,
5/4/2020,Pennsylvania,State,Announcement,Gov provided guidance businesses must follow to conduct in-person operations in counties slated to move to the yellow phase of reopening on May 8,,,,,,,,,,,,,,
5/6/2020,Pennsylvania,State,Announcement,"Gov announced the availability of a program to provide free N95 respirator decontamination to healthcare facilities, first responders, and other eligible organizations that may be experiencing a shortage of the respirators due to limited availability through normal procurement channels.",,,,,,,,,,,,,,
5/6/2020,Pennsylvania,State,Announcement,"Gov announced the creation of the Commonwealth Civilian Coronavirus Corps, a public service initiative that will support efforts this fall to increase testing and contact tracing and provide critical new job opportunities in the public health sector.",,,,,,,,,,,,,,
