Date,Location,Level,Type,Title/Description ,Comments,Travel restrictions,State of Emergency,School Closure ,Work Closure,Business closing,Gatherings,COVID/Antibody Testing,Safer at Home,Reopening,Relief/Funding/Grant,Masks,Other,Economics
7/1/2020,Indiana,State,Announcement,The state will modify the Back On Track Indiana plan through at least July 17.,"Amusement parks, water parks and similar facilities may continue operations open at 50 percent capacity. Reservations are encouraged to limit the number of customers at any one time.",,,,,,,,,,,,,
7/1/2020,Indiana,State,Announcement,The state will modify the Back On Track Indiana plan through at least July 17.,Raceways may continue operations open at 50 percent grandstand capacity. ,,,,,,,,,,,,,
3/10/2020,Iowa,State,Ordered,Cruise ship quarantined,,,,,,,,,,,,,,
3/15/2020,Iowa,State,Announcement,School closures.,Iowa schools close for four weeks.,,,,,,,,,,,,,
3/16/2020,Iowa,State,Announcement,Work assistance.,Various forms of assistance to workers and employers in the face of potential COVID-19 layoffs or furloughs.,,,,,,,,,,,,,
3/17/2020,Iowa,State,Signed,Medicaid appropriations,Supplemental appropriations for Medicaid ($88.98 million).,,,,,,,,,,,,,
3/17/2020,Iowa,State,Signed,Health program appropriations,Supplemental appropriations other health programs ($1.8 million).,,,,,,,,,,,,,
3/17/2020,Iowa,State,Signed,Hygienic Lab approriations,"Supplemental appropriations for state hygienic lab ($525,000).",,,,,,,,,,,,,
3/17/2020,Iowa,State,Signed,Limits standing appropriations,"Limits some standing appropriations (non-public school transportation, instructional support, AEA funding).",,,,,,,,,,,,,
3/17/2020,Iowa,State,Signed,Review FY 2020 aprropriations,Requires the Department of Management and the Legislative Service Agency to review FY 2020 appropriations and to make appropriations for the first two months of FY 2021.,,,,,,,,,,,,,
3/17/2020,Iowa,State,Signed,Economic Emergency Fund appropriations.,"Emergency appropriations from the Economic Emergency Fund of up to 10% to the DOM for purposes approved by the Governor, through August 31.",,,,,,,,,,,,,
3/17/2020,Iowa,State,Signed,Waive school instruction.,Authorizes the Governor to waive school instructional time requirements for schools that close due to COVID-19.,,,,,,,,,,,,,
3/17/2020,Iowa,State,Issued,Restaurant and bar closure.,"State of public health disaster emergency closes all restaurants and bars to the public until March 31, excluding take-out and drive thru options.",,,,,,,,,,,,,
3/18/2020,Iowa,State,Signed,Physician assistant role expansion.,Expands the roles of physician assistants in Iowa,,,,,,,,,,,,,
3/20/2020,Iowa ,State,Signed,Additional state public health emergency declaration provisions ,Temporarily suspends penalties and interest related to collection of property taxes until the end of this proclamation.,,,,,,,,,,,,,
3/20/2020,Iowa ,State,Signed,Additional state public health emergency declaration provisions ,Temporarily suspends some evictions under the Iowa Uniform Residential Landlord and Tenant Act or the Manufactured Home Communities or Mobile Home Parks Residential Landlord and Tenant Act in certain circumstances.,,,,,,,,,,,,,
3/20/2020,Iowa ,State,Signed,Additional state public health emergency declaration provisions ,Extends expiration deadline for a permit to carry and a permit to acquire a firearm and additional measures.,,,,,,,,,,,,,
3/20/2020,Iowa ,State,Signed,Additional state public health emergency declaration provisions ,"Permits the sale of carry-out, delivery, drive-thru alcohol for unopened bottles of alcohol for bars and restaurants and suspends some fees.",,,,,,,,,,,,,
3/20/2020,Iowa ,State,Signed,Additional state public health emergency declaration provisions ,Permits public meetings or hearings by electronic means to improve the functions of government while maintaining social distancing practices.,,,,,,,,,,,,,
3/20/2020,Iowa ,State,Signed,Additional state public health emergency declaration provisions ,"Suspends certain regulations to ease the transportation of agricultural supplies and commodities, food, medical supplies, cleaning products, and other household goods on all highways in Iowa.",,,,,,,,,,,,,
3/20/2020,Iowa ,State,Signed,Additional state public health emergency declaration provisions ,The proclamation also allows related state agencies to implement the state’s public health emergency plan.,,,,,,,,,,,,,
3/21/2020,Iowa,State,Announcement,U.S. Small Business Administration will issue an Economic Injury Disaster Loan declaration for Iowa.,,,,,,,,,,,,,,
3/22/2020,Iowa,State,Signed,New proclamation continuing the State Public Health Emergency Declaration. ,"The closure of salons, medical spas, barbershops, tattoo establishments, tanning facilities, massage therapy establishments, and swimming pools until March 31.",,,,,,,,,,,,,
3/22/2020,Iowa,State,Signed,New proclamation continuing the State Public Health Emergency Declaration. ,"Suspends all foreclosures on residential, commercial, and agricultural real property.",,,,,,,,,,,,,
3/22/2020,Iowa,State,Signed,New proclamation continuing the State Public Health Emergency Declaration. ,Professional licensing relief.,,,,,,,,,,,,,
3/23/2020,Iowa,State,Announcement,First quarter unemployment tax payments delayed. ,"first quarter unemployment tax payments that are due April 30th will be delayed till the end of the 2nd quarter, July 31, 2020. Eligible employers include those employers with 50 or fewer employees.",,,,,,,,,,,,,
3/25/2020,Iowa,State,Announcement,President Trump approved request for a Presidential Major Disaster Declaration for COVID-19. ,"notification that President Trump has approved her request for a Presidential Major Disaster Declaration for COVID-19, removing a $5 million cap on federal funds as well as making available the Community Disaster Loan program.",,,,,,,,,,,,,
3/25/2020,Iowa,State,Announcement,The Centers for Medicare & Medicaid Services (CMS) approve Iowa's request for Section 1135 Medicaid waiver.  ,The Centers for Medicare & Medicaid Services (CMS) approved Iowa’s request for a Section 1135 Medicaid waiver. The approved waiver enables Iowa to forgo certain pre-admission screening and annual resident review assessments in its Medicaid program.,,,,,,,,,,,,,
3/26/2020,Iowa,State,Issued,The Economic Development Authority created a COVID-19 Targeted Small Business Sole Operator Fund,"To support small businesses with zero employees – designed to help women, individuals with minority status, service-connected disabled veterans and individuals with disabilities overcome hurdles to start or grow a small business.",,,,,,,,,,,,,
3/26/2020,Iowa,State,Signed,New proclamation continuing the State Public Health Emergency Declaration,"Suspending elective and nonessential medical and dental procedures, extending and expanding retail business closures, ordering health care facilities and nursing homes to engage in advanced health care screenings.",,,,,,,,,,,,,
3/31/2020,Iowa,State,Signed,New proclamation continuing the state public health emergency declaration.,,,,,,,,,,,,,,
4/2/2020,Iowa,State,Signed,New proclamation continuing the State Public Health Emergency Declaration,"The proclamation orders the closure of schools, waiving time requirements as long as school districts put in place a continuous learning plan until April 30th.",,,,,,,,,,,,,
4/4/2020,Iowa,State,Announcement,$44 million has been obligated to the State of Iowa for reimbursement of expenses related to the COVID-19 response.,,,,,,,,,,,,,,
4/6/2020,Iowa,State,Signed,"New proclamation continuing the State Public Health Emergency Declaration, ordering additional closures and relaxing additional regulations.",,,,,,,,,,,,,,
4/8/2020,Iowa,State,Announcement,the state is expanding a grant program for small businesses,after receiving thousands of applications requesting assistance,,,,,,,,,,,,,
4/16/2020,Iowa,State,Signed,continuing theState Public Health Emergency Declaration and requiring additional protective measures in Region 6 (Northeastern Iowa).,"Limiting social, community, recreational, leisure, and sporting gatherings in Region 6 to only people who live together in the same household",,,,,,,,,,,,,
4/16/2020,Iowa,State,Signed,continuing theState Public Health Emergency Declaration and requiring additional protective measures in Region 6 (Northeastern Iowa).,"Continuing to limit weddings, funerals, and other spiritual or religious gatherings to no more than 10 people",,,,,,,,,,,,,
4/16/2020,Iowa,State,Announcement,The Governor has released an updated dashboard on coronavirus.iowa.gov that will be updated daily to include comprehensive tracking of COVID-19 in Iowa.,"The new dashboard includes cases, deaths, and tests conducted in each county. The state will also be providing demographic information that was not previously provided as well as Iowa’s epidemiological curve.",,,,,,,,,,,,,
4/17/2020,Iowa,State,Announcement,Plans to reopen Iowa through a “phased-in manner” following the guidelines issued by the president.,,,,,,,,,,,,,,
4/19/2020,Iowa,State,Announcement,All school districts and nonpublic schools will be closed for the remainder of the school year.,,,,,,,,,,,,,,
4/20/2020,Iowa,State,Announcement,Iowa meatpacking plants will stay open.,,,,,,,,,,,,,,
4/21/2020,Iowa,State,Announcement,Test Iowa Initiative to expand testing capacity to limit the spread of COVID-19 in Iowa.,"The state is partnering with Nomi Health and DOMO, which are part of a partnership that launched a similar initiative in the state of Utah.",,,,,,,,,,,,,
4/24/2020,Iowa,State,Signed,A new proclamation continuing the State Public Health Emergency Declaration.,"The proclamation permits health care providers to begin the process of resuming some elective surgeries and procedures through a phased approach, permits farmers markets to begin limited operations with appropriate public health precautions, and outlines other measures.",,,,,,,,,,,,,
4/27/2020,Iowa,State,Signed,"The Governor signed a new proclamation continuing the State Public Health Emergency Declaration until May 27, 2020.","The proclamation loosens social distancing measures in 77 Iowa counties effective Friday, May 1 and continues other restrictions until 11:50 p.m. on Friday, May 15, 2020. In the 77 counties, the proclamation permits restaurants, fitness centers, malls, libraries, racetracks, and certain other retail establishments to reopen in a limited fashion with public health measures in place.",,,,,,,,,,,,,
4/27/2020,Iowa,State,Announcement,"The Governor, U.S. Senators Joni Ernst and Chuck Grassley, and Iowa Secretary of Agriculture Mike Naig wrote a letter to the Vice President asking for additional support from the administration for the state’s pork producers.",,,,,,,,,,,,,,
4/29/2020,Iowa,State,Announcement,"The Governor’s Iowa Workforce Development Agency, stated that during gradual reopen procedures if an employee refuses to return to work at a business that is opening again, that it would be considered as a “voluntary quit”",This would disqualify them from receiving unemployment benefits.,,,,,,,,,,,,,
5/4/2020,Iowa,State,Announcement,The state would clear its backlog of COVID-19 test results at the State Hygienic Laboratory by the end of Monday May 4th.,,,,,,,,,,,,,,
5/5/2020,Iowa,State,Announcement,The Governor will travel to Washington to meet with President Donald Trump and Vice President Mike Pence to discuss Iowa’s response to the coronavirus pandemic.,,,,,,,,,,,,,,
5/6/2020,Iowa,State,Signed,A new proclamation continuing the Public Health Disaster Emergency.,"The proclamation permits dental services to resume in compliance with guidelines adopted by the Iowa Dental Board, permits some additional businesses and establishments to reopen throughout Iowa in a limited fashion with appropriate public health measures in place, and provides additional regulatory relief to assist Iowans affected by this disaster.",,,,,,,,,,,,,
5/7/2020,Iowa,State,Announcement,The Centers for Medicare and Medicaid Services (CMS) approved Iowa’s second request for a Medicaid 1135 waiver.,"The waiver allows Iowa to provide flexibilities in Medicaid provider screening and enrollment, forgo evaluation and assessment requirements for home and community-based services, and allow for reimbursement facility services in alternative settings.",,,,,,,,,,,,,
5/11/2020,Iowa,State,Announcement,The Governor will be following modified quarantine plan after learning a member of Vice President Mike Pence’s staff tested positive for the virus.,Gov. Reynolds says her temperature is being taken before she enters the building prior to her press briefing and she is being tested everyday.,,,,,,,,,,,,,
5/11/2020,Iowa,State,Announcement,The Governor will update her office’s public health guidelines in an updated proclamation. ,According to information provided during her daily coronavirus briefing.,,,,,,,,,,,,,
5/13/2020,Iowa,State,Signed,A new proclamation continuing the Public Health Disaster Emergency.,"The proclamation permits salons, barbershops, and massage and tattoo establishments to reopen throughout Iowa in a limited fashion with appropriate public health measures in place. It also permits restaurants (but not bars), fitness centers, libraries, and racetracks to reopen in the 22 counties where they have remained closed. The proclamation continues the other ongoing closures and public health measures, including the prohibition on social, community, recreational, leisure, and sporting gatherings and events of more than 10 people, until 11:59 p.m. on May 27, 2020.",,,,,,,,,,,,,
5/14/2020,Iowa,State,Announcement,"Test Iowa’s equipment has been validated and believes the state “has the capacity” to do 5,000 tests per day. ","3,000 via the Test Iowa program and another 2,000 through the state hygienic lab.",,,,,,,,,,,,,
5/20/2020,Iowa,State,Signed,A new proclamation continuing the Public Health Disaster Emergency.,"The proclamation permits summer school activities, including baseball and softball, to resume on June 1. Effective May 22, Movie theaters, zoos, aquariums, museums, and wedding reception venues will be permitted to reopen with appropriate public health measures in place. Swimming pools will also be permitted to reopen for lap swimming and swimming lessons.",,,,,,,,,,,,,
5/20/2020,Iowa,State,Announcement,"On Thursday, May 28, bars and other alcohol-related establishments that have been limited to carryout and delivery will be permitted to reopen for indoor or outdoor seating.",These establishments will follow the same public health measures that restaurants have been implementing for the past several weeks.,,,,,,,,,,,,,
5/26/2020,Iowa,State,Signed,"The Governor signed a new proclamation continuing the Public Health Disaster Emergency until June 25, 2020.","The proclamation permits bars, wineries, breweries, distilleries, and social and fraternal clubs may reopen on May 28 with the same public health measures as restaurants in place. The proclamation also permits the reopening on June 1 of additional establishments, including outdoor performance venues, casinos, bowling alleys, amusement parks, skating rinks, skate parks, outdoor playgrounds.",,,,,,,,,,,,,
5/26/2020,Iowa,State,Announcement,"June 1, speedways, and racetracks can open events to spectators.","Outdoor venues like grandstands and amphitheaters may hold performances. Casinos may reopen, along with amusement parks, bowling alleys, pool halls, and arcades. All must maintain 50% capacity while keeping social distancing and hygiene protocols going.",,,,,,,,,,,,,
5/27/2020,Iowa,State,Announcement,Confirmed cases of COVID-19 are trending toward the western side of the state.,,,,,,,,,,,,,,
5/27/2020,Iowa,State,Announcement,150 National Guard soldiers are assisting with contact tracing.,,,,,,,,,,,,,,
6/1/2020,Iowa,State,Announcement,The Governor and the Iowa Department of Education announced the state has received $26.2 million in federal relief. ,To ensure education continues for students of all ages impacted by the COVID-19 pandemic.,,,,,,,,,,,,,
6/8/2020,Iowa,State,Announcement,The Governor will further expand access to COVID-19 testing with new sites opening this week. ,"Including one in Dallas County to better serve the Des Moines metro area, and four clinic sites in rural communities.",,,,,,,,,,,,,
6/15/2020,Iowa,State,Announcement,The Governor wrote a letter to Iowa Senators and the Secretary of the Department of Agriculture. ,The Governor is asking for more federal support for state turkey producers due to disruptions occurring in the supply chain.,,,,,,,,,,,,,
6/18/2020,Iowa,State,Signed,Executive Order. ,"Establishing the Governor’s Economic Recovery Advisory Board. The advisory board will focus on modernizing Iowa’s economy as well as education, health care, workforce and quality of life.",,,,,,,,,,,,,
3/12/2020,Kansas,State,Announcement,State of Emergency. ,,,,,,,,,,,,,,
3/15/2020,Kansas,State,Announcement,School closures.,K-12 school in Kansas close for the week of March 15.,,,,,,,,,,,,,
3/16/2020,Kansas,State,Ordered,Gathering limitaions,"Banned all gatherings larger than 50 people, bringing the entire state in line with restrictions already announced in Wichita and Kansas City.",,,,,,,,,,,,,
3/17/2020,Kansas,State,Ordered,Working from home,"Effective Monday, March 23, that state employees state home for two weeks on administrative leave to minimize additional risk of exposure to the virus.",,,,,,,,,,,,,
3/17/2020,Kansas,State,Ordered,School closures.,Closure of all K-12 schools in the state until the end of the school year.,,,,,,,,,,,,,
3/17/2020,Kansas,State,Ordered,Executive order: Gathering limitations,Limiting public gathering to no more than 50 people,,,,,,,,,,,,,
3/17/2020,Kansas,State,Ordered,Executive order: Suspend utility disconnections,Asked the Kansas Corporation Commission (KCC) to suspend utility disconnects until April 15.,,,,,,,,,,,,,
3/18/2020,Kansas,State,Announcement,Prohibit evictions and foreclosures,Executive Order #20-06 to temporarily prohibit evictions and foreclosures across the state.,,,,,,,,,,,,,
3/19/2020,Kansas,State,Signed,Senate Bill for unemployment eligibility,"Senate Bill 27 extends unemployment eligibility for workers who filed after January 1, 2020.",,,,,,,,,,,,,
3/19/2020,Kansas,State,Signed,Senate Bill for education waiver expansion.,Senate Bill 142 expands education waiver authorities during disaster emergencies.,,,,,,,,,,,,,
3/19/2020,Kansas,State,Signed,Senate Bill for judicial branch authority expansion.,Senate Bill 102 expands authorities of the judicial branch during disasters.,,,,,,,,,,,,,
3/20/1930,Kansas,State,Announcement,Disaster assistance loans from the U.S. Small Business Administration (SBA) to supplement small businesses.,"Under the state’s disaster declaration Kansas has applied for, and expects to receive, disaster assistance loans from the U.S. Small Business Administration (SBA) to supplement small businesses.",,,,,,,,,,,,,
3/20/2020,Kansas,State,Announcement,Establish the Hospitality Industry Relief Emergency (HIRE) Fund,"Allocation of 5 million of state funds to establish the Hospitality Industry Relief Emergency (HIRE) Fund to provide short-term, zero-interest loans for Kansas’ hospitality sector",,,,,,,,,,,,,
3/22/2020,Kansas,State,Signed,Executive Order ,Temporarily expanding telemedicine and addressing certain licensing requirements.,,,,,,,,,,,,,
3/22/2020,Kansas,State,Signed,Executive Order,For conditional and temporary relief from certain motor carrier rules and regulations.,,,,,,,,,,,,,
3/23/2020,Kansas,State,Signed,Executive Order,limiting mass gathering to 10 people.,,,,,,,,,,,,,
3/23/2020,Kansas,State,Signed,Executive Order,"Preventing all Kansas waste removal providers, trash and recycling, from cancelling or suspending commercial or residential waste or recycling removal services for Kansas residences and businesses as a result of nonpayment due to significant loss of income or increase in expenses resulting from the COVID-19 pandemic.",,,,,,,,,,,,,
3/23/2020,Kansas,State,Signed,Executive Order,"Extending tax filing deadlines to July 15, 2020, and waiving any interest and penalties for returns and payments made on or before July 15, 2020.",,,,,,,,,,,,,
3/25/2020,Kansas,State,Signed,State Budget ,"Approves $65 million for Kansas coronavirus response.
",,,,,,,,,,,,,
3/25/2020,Kansas,State,Signed ,Executive Order ,Establishing the Kansas Essential Function Framework for the COVID-19 response.,,,,,,,,,,,,,
3/25/2020,Kansas,State,Announcement,The Centers for Medicare & Medicaid Services (CMS) approve Kansas’ request for a Section 1135 Medicaid waiver. ,"The approved waiver enables Kansas to provide flexibilities in Medicaid provider screening and enrollment, forgo certain pre-admission screening and annual resident review assessments, lift prior authorization requirements, and extend fair hearing and appeals timelines.",,,,,,,,,,,,,
3/28/2020,Kansas,State,Signed,Executive Order ,"Instituting a temporary, statewide stay-home order until Sunday, April 19.",,,,,,,,,,,,,
3/31/2020,Kansas,State,Signed,"New executive order making changes to the state’s employment security law. 
",The waiting week requirement for unemployment benefits will be temporarily waived for all claimants. ,,,,,,,,,,,,,
3/31/2020,Kansas,State,Signed,"New executive order making changes to the state’s employment security law. 
",The requirement that Kansans receiving unemployment benefits actively seek work each week will be temporarily waived for all claimants to allow Kansans to continue the necessary social distancing practices. ,,,,,,,,,,,,,
3/31/2020,Kansas,State,Signed,"New executive order making changes to the state’s employment security law. 
","All Kansas employers, as required by the federal Department of Labor, will be required to notify separated employees if they qualify for unemployment insurance.",,,,,,,,,,,,,
4/7/2020,Kansas,State,Signed,Executive Order. ,Primarily brings religious institutions and religious and non-religious funerals in line with the a previous order that limited public gatherings to 10 or fewer people.,,,,,,,,,,,,,
4/8/2020,Kansas,State,Announcement,Legal action against members of the Legislative Coordinating Council (LCC). ,Over its revocation of an executive order she issued that limited mass gatherings to 10 or fewer people.,,,,,,,,,,,,,
4/9/2020,Kansas,State,Signed,Executive Order. ,Extending professional and occupational licensing.,,,,,,,,,,,,,
4/9/2020,Kansas,State,Signed,Executive Order. ,Temporary allowing notaries and witnesses to act via audio-video technology.,,,,,,,,,,,,,
4/11/2020,Kansas,State,Announcement,The Kansas Supreme Court upheld the Governor’s executive order. ,"Limiting the size of mass gathering to 10 people, including that of church services and funerals.",,,,,,,,,,,,,
4/13/2020,Kansas,State,Signed,Executive Order. ,Extending the temporary relief for motor carriers from certain rules and regulations.,,,,,,,,,,,,,
4/15/2020,Kansas,State,Announcement,The Governor has extended the stay-at-home order until May 1st.,,,,,,,,,,,,,,
4/15/2020,Kansas,State,Signed,Executive Order. ,"Brings adult care homes in line with other occupational licensing exemptions. All state agencies working or collaborating with the Kansas Department for Aging and Disability Services shall extend renewal deadlines for any occupational or professional license, certificate or registration as needed.",,,,,,,,,,,,,
4/16/2020,Kansas,State,Signed,Executive Order. ,Extending the stay at home order to May 3.,,,,,,,,,,,,,
4/16/2020,Kansas,State,Announcement,The Governor stated that her state and other rural states have struggled to get medical supplies. ,Her public health teams identifies as a prerequisite to easing social distancing requirements.,,,,,,,,,,,,,
4/20/2020,Kansas,State,Announcement,Kansas received additional supplies and personal protective equipment (PPE) from federal partners,"to expand COVID-19 testing in Finney, Ford, Lyon and Seward counties.",,,,,,,,,,,,,
4/21/2020,Kansas,State,Announcement,the Kansas Department of Health and Environment (KDHE) has released new guidelines on COVID-19 testing.,People exhibiting two symptoms will now be able to get tested.,,,,,,,,,,,,,
4/22/2020,Kansas,State,Announcement,The Governor's administration has been in communication with the state’s impacted meat processing facilities’ representatives,Their employees and local health officials and those facilities have taken several steps to modify their production and shipping systems.,,,,,,,,,,,,,
4/22/2020,Kansas,State,,The state has coordinated with local agencies to secure temporary emergency housing for some people who have been isolated for observation or quarantined for two weeks in four counties,With large meatpacking plants affected by the virus.,,,,,,,,,,,,,
4/22/2020,Kansas,State,Signed,Executive Order ,"Temporarily waiving physician supervision or collaboration requirements for certain medical licensees, including advanced practice registered nurses, physician assistants and licensed practical nurses.",,,,,,,,,,,,,
4/22/2020,Kansas,State,Signed,Executive Order ,The order also allows out-of-state health care providers to practice in Kansas.,,,,,,,,,,,,,
4/28/2020,Kansas,State,Signed,Executive Order ,"Allowing for the sale of alcoholic beverages for carryout consumption and permits the sale of liquor in a container that is not the original container for any establishment holding a class A club license, class B club license or drinking establishment license.",,,,,,,,,,,,,
4/30/2020,Kansas,State,Announcement,"Detailed framework for gradually, safely re-opening the economy and getting Kansas back to work, via Executive Order 20-29. ","Phase One will take effect on Monday, May 4, 2020, via Executive Order 20-29, when the statewide stay-home order outlined in Executive Order 20-16 officially lifts.",,,,,,,,,,,,,
